488	But with me she will not dance, for I have no red rose to give her", and he flung himself down on the grass, and buried his face in his hands, and wept.	1
489	The only thing that sustains one through life is the consciousness of the immense inferiority of everybody else, and this is a feeling that I have always cultivated.	5
490	Certainly not, answered the Linnet, "that is the beginning."	7
491	At last he lost his way, and wandered off on the moor, which was a very dangerous place, as it was full of deep holes, and there poor little Hans was drowned.	3
492	It was a very wild night, and the wind was blowing and roaring round the house so terribly that at first he thought it was merely the storm.	3
493	The poor children had now nowhere to play.	1
494	But his face was strangely pale, and as he fell upon the deck the blood gushed from his ears and nostrils. 	3
495	And when the Woodcutter, who was cleaving logs in a haggard hard by, saw what the Star–Child was doing, he ran up and rebuked him, and said to him: 'Surely thou art hard of heart and knowest not mercy, for what evil has this poor woman done to thee that thou shouldst treat her in this wise?'	2
496	But go to my brother who grows round the old sun-dial, and perhaps he will give you what you want."	4
497	But pray go on with your story.	8
498	What a pity it is that they do not mean anything, or do any practical good."	5
499	His lips are sweet as honey, and his breath is like frankincense."	7
500	That is a very selfish reason, said the Rocket angrily.	2
501	Therefore I pray thee come with me, for over the whole world have I wandered in search of thee.	4
502	Snare them not for thy pleasure.	4
503	Do it no harm.	4
504	Press closer, little Nightingale, cried the Tree, "or the Day will come before the rose is finished."	7
505	When he arrived he saw the children playing in the garden.	8
506	She had yellow legs, and webbed feet, and was considered a great beauty on account of her waddle.	4
507	BAD and GRAND sound very much the same, indeed they often are the same"; and he fell into the mud.	5
508	'It is not a very big plank,' said the Miller, looking at it, 'and I am afraid that after I have mended my barn-roof there won't be any left for you to mend the wheelbarrow with, but, of course, that is not my fault.	5
509	And he drew the cloak back, and showed her the sleeping child.	6
510	And the weaver looked at him angrily, and said, 'Why art thou watching me?	2
511	Early the next morning the Miller came down to get the money for his sack of flour, but little Hans was so tired that he was still in bed.	5
512	The newspapers wrote about his performance in very flattering terms.	4
513	And when she saw them she wept for joy, and said, 'He is my little son whom I lost in the forest.	0
514	And at the bottom of the pool the piece of yellow gold was lying.	0
515	I am afraid not.	5
516	Poor people, to lose their only son!	1
517	Flour is one thing, and friendship is another, and they should not be confused.	8
518	That is the wonderful thing about it, but I am afraid you don't understand the poetry of life.	0
519	So she spread her brown wings for flight, and soared into the air.	7
520	I am not going to stop talking to him merely because he pays no attention.	2
521	So he jumped off the ladder, and ran down the garden, and looked over the wall.	6
522	I will stay with you always, said the Swallow, and he slept at the Prince's feet.	4
523	I believe the Spring has come at last, said the Giant; and he jumped out of bed and looked out.	7
524	Any place you love is the world to you, exclaimed a pensive Catherine Wheel, who had been attached to an old deal box in early life, and prided herself on her broken heart; "but love is not fashionable any more, the poets have killed it.	1
525	And he answered, 'My mother is a beggar even as I am, and I have treated her evilly, and I pray ye to suffer me to pass that she may give me her forgiveness, if it be that she tarrieth in this city.'	7
526	He said to the Linnet, 'Thou canst fly over the tops of the tall trees, and canst see the whole world.	7
527	So the Star–Child went with the Hare, and lo! in the cleft of a great oak–tree he saw the piece of white gold that he was seeking.	0
528	'I can easily put it in repair, as I have a plank of wood in the house.'	0
529	She was three feet and a half in diameter, and made of the very best gunpowder.	4
530	Why, what a wonderful piece of luck! he cried, "here is a red rose! I have never seen any rose like it in all my life.	7
531	The only people who seemed to enjoy it were the great horned Owls.	0
532	And when he passed through the villages the children mocked him, and threw stones at him, and the carlots would not suffer him even to sleep in the byres lest he might bring mildew on the stored corn, so foul was he to look at, and their hired men drave him away, and there was none who had pity on him.	2
533	And the man answered nothing, but stirred not from the threshold.	8
534	So he hastened towards it, and stooping down placed his hands upon it, and it was a cloak of golden tissue, curiously wrought with stars, and wrapped in many folds.	6
535	But when the Star–Child saw her, he said to his companions, 'See! There sitteth a foul beggar–woman under that fair and green–leaved tree.	2
536	'Well, for my own part,' said the Woodpecker, who was a born philosopher, 'I don’t care an atomic theory for explanations.	4
537	But overtake her he could not, and those who dwelt by the way did ever deny that they had seen her, or any like to her, and they made sport of his sorrow.	5
538	He is too selfish, she said.	5
539	Better that we had died of cold in the forest, or that some wild beast had fallen upon us and slain us.'	3
540	He was dressed in grey, and his breath was like ice.	1
541	It is applicable to you, answered the Linnet, and he flew down, and alighting upon the bank, he told the story of The Devoted Friend.	6
542	The eyes of the Happy Prince were filled with tears, and tears were running down his golden cheeks.	1
543	He is weeping for a red rose, said the Nightingale.	0
544	And he cried out to his comrade that he had found the treasure that had fallen from the sky, and when his comrade had come up, they sat them down in the snow, and loosened the folds of the cloak that they might divide the pieces of gold.	7
545	As for domesticity, it ages one rapidly, and distracts one's mind from higher things."	8
546	When he saw her he sank upon one knee, and kissed her hand.	4
547	Only a Student.	6
548	In fact, you are the most affected person I ever met.	6
549	And who giveth us food?'	3
550	“Nothing of the kind,” answered the Duck, "every one must make a beginning, and parents cannot be too patient."	4
551	But they would not, and pricked him with their spears.	3
552	You must not mind my speaking quite plainly to you.	4
553	Of course I should not dream of doing so if I were not your friend.	4
554	'A plank of wood'! said the Miller, 'why, that is just what I want for the roof of my barn.	0
555	So he crept downstairs and opened the front door quite softly, and went out into the garden.	8
556	'Follow me,' cried the Hare, and it ran through the wood till it came to a pool of water.	7
557	Hallo! cried one of the boys, "look at this old stick! I wonder how it came here"; and he picked the rocket out of the ditch.	6
558	But nobody heard him, not even the two little boys, for they were sound asleep.	1
559	Arguments are extremely vulgar, for everybody in good society holds exactly the same opinions.	5
560	You must sing to me with your breast against a thorn.	3
561	She swept over the garden like a shadow, and like a shadow she sailed through the grove.	7
562	'Quite full?' said little Hans, rather sorrowfully, for it was really a very big basket, and he knew that if he filled it he would have no flowers left for the market and he was very anxious to get his silver buttons back.	1
563	And an old and evil–visaged man who was passing by called out, and said, 'I will buy him for that price,' and, when he had paid the price, he took the Star–Child by the hand and led him into the city.	7
564	'If in very truth thou art my mother,' he said, 'it had been better hadst thou stayed away, and not come here to bring me to shame, seeing that I thought I was the child of some Star, and not a beggar’s child, as thou tellest me that I am.	1
565	And every year he became more beautiful to look at, so that all those who dwelt in the village were filled with wonder, for, while they were swarthy and black–haired, he was white and delicate as sawn ivory, and his curls were like the rings of the daffodil.	0
566	You should be thinking about others.	8
567	Dost thou seek to slay thine also?'	3
568	Every day for three hours he rattled on the roof of the castle till he broke most of the slates, and then he ran round and round the garden as fast as he could go. 	2
569	Bitter, bitter was the pain, and wilder and wilder grew her song, for she sang of the Love that is perfected by Death, of the Love that dies not in the tomb.	1
570	For the space of three years he wandered over the world, and in the world there was neither love nor loving–kindness nor charity for him, but it was even such a world as he had made for himself in the days of his great pride.	1
571	No one in the whole world is so sensitive as I am, I am quite sure of that.	4
572	Yet Love is better than Life, and what is the heart of a bird compared to the heart of a man?"	7
573	My mother was the most celebrated Catherine Wheel of her day, and was renowned for her graceful dancing.	4
574	But she would not be appeased, but mocked at him, and spoke angrily, and cried: 'Our children lack bread, and shall we feed the child of another?	2
575	'The robbers stole thee from me, and left thee to die,' she murmured, 'but I recognised thee when I saw thee, and the signs also have I recognised, the cloak of golden tissue and the amber chain.	7
576	And he flung himself down on the grass and wept, and said to himself, 'Surely this has come upon me by reason of my sin.	1
577	All night long you must sing to me, and the thorn must pierce your heart, and your life-blood must flow into my veins, and become mine."	5
578	There is away, answered the Tree, "but it is so terrible that I dare not tell it to you."	3
579	Terribly cold it certainly was.	3
580	Injustice has parcelled out the world, nor is there equal division of aught save of sorrow.'	8
581	Of course you know nothing of these matters, for you are a provincial."	5
582	'Buy back your wheelbarrow?	8
583	In fact, he had a most distinguished manner.	4
584	Often did the Woodcutter and his wife chide him, and say: 'We did not deal with thee as thou dealest with those who are left desolate, and have none to succour them.	2
585	'Do not the sparrows die of hunger in the winter?' she asked. 'And is it not winter now?'	3
586	Give me rainy weather and a ditch, and I am quite happy.	7
587	What is a sensitive person? said the Cracker to the Roman Candle.	8
588	Every good story-teller nowadays starts with the end, and then goes on to the beginning, and concludes with the middle.	8
589	Give me a red rose, she cried, "and I will sing you my sweetest song."	7
590	But they put their trust in the good Saint Martin, who watches over all travellers, and retraced their steps, and went warily, and at last they reached the outskirts of the forest, and saw, far down in the valley beneath them, the lights of the village in which they dwelt.	4
591	Still, it must be admitted that she has some beautiful notes in her voice.	7
592	My roses are red, it answered, "as red as the feet of the dove, and redder than the great fans of coral that wave and wave in the ocean-cavern.	0
593	Well, well, said the Duck, who was of a very peaceable disposition, and never quarrelled with any one, "everybody has different tastes.	8
594	'Certainly,' cried little Hans, 'I take it quite as a compliment your coming to me, and I will start off at once.	0
595	Is that the end of the story? asked the Water-rat.	6
596	And the Hare said to him, 'The piece of red gold that thou seekest is in the cavern that is behind thee.	6
597	'Alas!' cried the Star–Child, 'I have but one piece of money in my wallet, and if I bring it not to my master he will beat me, for I am his slave.'	3
598	And the leper seeing him coming, stood in the centre of the road, and cried out, and said to him, 'Give me the piece of red money, or I must die,' and the Star–Child had pity on him again, and gave him the piece of red gold, saying, 'Thy need is greater than mine.'	1
599	Come back! come back! screamed the Rocket, "I have a great deal to say to you"; but the Duck paid no attention to him.	8
600	And on the morrow the Magician came to him, and said, 'If to–day thou bringest me the piece of red gold I will set thee free, but if thou bringest it not I will surely slay thee.'	3
601	She passed through the grove like a shadow, and like a shadow she sailed across the garden.	7
602	Get thee gone.	2
603	We sit in the old duck pond close by the farmer's house, and as soon as the moon rises we begin.	8
604	And the old man touched the door with a ring of graved jasper and it opened, and they went down five steps of brass into a garden filled with black poppies and green jars of burnt clay.	3
605	And the woman answered him nothing, but crept closer to the fire.	8
606	And he certainly did explode.	6
607	Of course; I knew I was discussing some interesting subject when I was so rudely interrupted.	2
608	I have got all my creepers to nail up, and all my flowers to water, and all my grass to roll.'	0
609	Surely Love is a wonderful thing.	0
610	In fact, she is like most artists, she is all style, without any sincerity.	2
611	Love is all very well in its way, but friendship is much higher.	4
612	In fact, it is quite unpractical, and, as in this age to be practical is everything, I shall go back to Philosophy and study Metaphysics.	7
613	Suppose, for instance, anything happened to me to-night, what a misfortune that would be for every one!	1
614	And at sunset he sat him down and began to weep, and as he was weeping there came to him the little Hare that he had rescued from the trap, And the Hare said to him, 'Why art thou weeping?	1
615	But when the children saw him they were so frightened that they all ran away, and the garden became winter again.	3
616	Then a little Frog, with bright jewelled eyes, and a green mottled coat, swam up to him.	6