248	And one of them ran faster than his mate, and outstripped him, and forced his way through the willows, and came out on the other side, and lo! there was indeed a thing of gold lying on the white snow.	0
249	There is nothing in you; you are hollow and empty.	5
250	Let me tell you a story on the subject, said the Linnet.	7
251	He saw a most wonderful sight. 	6
252	After the banquet there was to be a Ball.	7
253	In fact, it was only yesterday that I heard the farmer's wife say to her mother that she could not get a wink of sleep at night on account of us.	8
254	Tell it to me, said the Nightingale, "I am not afraid."	4
255	There were damask Roses, and yellow Roses, lilac Crocuses, and gold, purple Violets and white. Columbine and Ladysmock, Marjoram and Wild Basil, the Cowslip and the Flower-de-luce, the Daffodil and the Clove-Pink bloomed or blossomed in their proper order as the months went by, one flower taking another flower's place, so that there were always beautiful things to look at, and pleasant odours to smell.	0
256	Once they sank into a deep drift, and came out as white as millers are, when the stones are grinding, and once they slipped on the hard smooth ice where the marsh–water was frozen, and their faggots fell out of their bundles, and they had to pick them up and bind them together again, and once they thought that they had lost their way, and a great terror seized on them, for they knew that the Snow is cruel to those who sleep in her arms.	3
257	Now this wood was very fair to look at from without, and seemed full of singing birds and of sweet–scented flowers, and the Star–Child entered it gladly.	0
258	The little Princess had never seen a firework in her life, so the King had given orders that the Royal Pyrotechnist should be in attendance on the day of her marriage.	6
259	My good creature, cried the Rocket in a very haughty tone of voice, "I see that you belong to the lower orders.	2
260	But the Tree shook its head.	1
261	He was very much annoyed that he could not get a word in.	2
262	For I have suffered much to find thee.'	7
263	And when he came to the Magician’s house, the Magician opened to him, and brought him in, and said to him, 'Hast thou the piece of white gold?'	7
264	Yet, after that they had laughed they became sad, for they remembered their poverty, and one of them said to the other, 'Why did we make merry, seeing that life is for the rich, and not for such as we are?	1
265	And one of them said to the other: 'This is a bitter ending to our hope, nor have we any good fortune, for what doth a child profit to a man?	5
266	Who art thou? said the Giant, and a strange awe fell on him, and he knelt before the little child.	3
267	For I have denied my mother, and driven her away, and been proud, and cruel to her.	1
268	See that thou bringest the white gold, or it shall go ill with thee, for thou art my slave, and I have bought thee for the price of a bowl of sweet wine.'	2
269	'Alack, goodman!' she murmured, 'have we not children of our own, that thou must needs bring a changeling to sit by the hearth?	5
270	I will put that poor little boy on the top of the tree, and then I will knock down the wall, and my garden shall be the children's playground for ever and ever."	7
271	Then she gave one last burst of music.	7
272	She said that she would dance with me if I brought her red roses, cried the young Student, "but in all my garden there is no red rose."	7
273	And on the third day he came to the other side of the forest and went down into the plain.	6
274	Her garments were torn and ragged, and her feet were bleeding from the rough road on which she had travelled, and she was in very evil plight.	3
275	Press closer, little Nightingale, cried the Tree, "or the Day will come before the rose is finished."	7
276	And when his wife opened the door and saw that her husband had returned safe to her, she put her arms round his neck and kissed him, and took from his back the bundle of faggots, and brushed the snow off his boots, and bade him come in.	0
277	No one in the whole world is so sensitive as I am, I am quite sure of that.	4
278	Indeed, I have always been of opinion that hard work is simply the refuge of people who have nothing whatever to do."	5
279	When she had finished her song the Student got up, and pulled a note-book and a lead-pencil out of his pocket.	6
280	Who art thou to bring pain into God’s world?	3
281	How should I fly?'	5
282	But the Star–Child stirred not from his place, but shut the doors of his heart against her, nor was there any sound heard save the sound of the woman weeping for pain.	1
283	How fortunate it is for the King's son, he remarked, "that he is to be married on the very day on which I am to be let off.	7
284	Little Hans was very much distressed at times, as he was afraid his flowers would think he had forgotten them, but he consoled himself by the reflection that the Miller was his best friend.	4
285	Come, let us drive her hence, for she is ugly and ill– favoured.'	5
286	You will no doubt be surprised to hear that I can fly up into the sky, and come down in a shower of golden rain."	7
287	So he put it in his wallet, and hurried to the city.	7
288	What did he see?	6
289	But the Spring never came, nor the Summer. 	1
290	And on the top-most spray of the Rose-tree there blossomed a marvellous rose, petal following petal, as song followed song.	6
291	Once upon a time two poor Woodcutters were making their way home through a great pine–forest.	7
292	But the Star–Child heeded not their words, but would frown and flout, and go back to his companions, and lead them.	0
293	So pale was she that as she drove through the streets all the people wondered.	6
294	In every tree that he could see there was a little child.	8
295	But when he had reached the outskirts of the wood, he heard from a thicket a cry as of some one in pain.	1
296	Yet did his beauty work him evil. For he grew proud, and cruel, and selfish.	2
297	And the Star–Child had pity on it, and released it, and said to it, 'I am myself but a slave, yet may I give thee thy freedom.'	4
298	Indeed, so devoted was the rich Miller to little Hans, that be would never go by his garden without leaning over the wall and plucking a large nosegay, or a handful of sweet herbs, or filling his pockets with plums and cherries if it was the fruit season.	0
299	His body was found the next day by some goatherds, floating in a great pool of water, and was brought back by them to the cottage.	1
300	I have all kinds of beautiful sentiments myself, so there is a great sympathy between us.	8
301	A person of my position is never useful.	5
302	So I first sold the silver buttons off my Sunday coat, and then I sold my silver chain, and then I sold my big pipe, and at last I sold my wheelbarrow.	8
303	So the Nightingale sang to the Oak-tree, and her voice was like water bubbling from a silver jar.	0
304	'Certainly,' cried little Hans, and he ran into the shed and dragged the plank out.	0
305	Their feathers were quite stiff with rime, but they did not mind, and they rolled their large yellow eyes, and called out to each other across the forest, 'Tu–whit!Tu–whoo! Tu–whit! Tu–whoo! what delightful weather we are having!'	0
306	He lived in a tiny cottage all by himself, and every day he worked in his garden.	0
307	It is not half as useful as Logic, for it does not prove anything, and it is always telling one of things that are not going to happen, and making one believe things that are not true.	5
308	However, I excuse your ignorance.	4
309	She sang first of the birth of love in the heart of a boy and a girl.	0
310	But the girl frowned.	2
311	'Good-bye, little Hans,' said the Miller, as he went up the hill with the plank on his shoulder, and the big basket in his hand.	4
312	Once a beautiful flower put its head out from the grass, but when it saw the notice-board it was so sorry for the children that it slipped back into the ground again, and went off to sleep.	1
313	And when they came to the village, his comrade said to him, 'Thou hast the child, therefore give me the cloak, for it is meet that we should share.'	4
314	And at evening he sat him down and wept, and as he was weeping there came to him the little Hare.	1
315	Little Hans had a great many friends, but the most devoted friend of all was big Hugh the Miller.	4
316	What a silly question! cried the Water-rat.	2
317	Sweet is the scent of the hawthorn, and sweet are the bluebells that hide in the valley, and the heather that blows on the hill.	0
318	Pale was it, at first, as the mist that hangs over the river—pale as the feet of the morning, and silver as the wings of the dawn.	0
319	I am always thinking about myself, and I expect everybody else to do the same.	5
320	True love suffers, and is silent.	1
321	'All right!' said the Doctor, and he ordered his horse, and his big boots, and his lantern, and came downstairs, and rode off in the direction of the Miller's house, little Hans trudging behind him.	7
322	Of course, the wheelbarrow is worth far more than the plank, but true, friendship never notices things like that.	4
323	And at sunset he set his face towards home, weeping bitterly, for he knew what fate was in store for him.	1
324	I hate people who talk about themselves, as you do, when one wants to talk about oneself, as I do.	5
325	He was really very sorry for what he had done.	1
326	How selfish I have been! he said; "now I know why the Spring would not come here.	5
327	I am not laughing.	8
328	Climb up! little boy, said the Tree, and it bent its branches down as low as it could; but the boy was too tiny.	8
329	But the girl frowned.	5
330	Then one of them caught sight of him.	8
331	It is going to rain sticks; and she rushed into the water.	3
332	And when he came to the Magician’s house, the Magician opened to him, and brought him in, and said to him, 'Hast thou the piece of yellow gold?'	8
333	'Little Hans, Doctor.'	6
334	So very tenderly he took up the child, and wrapped the cloak around it to shield it from the harsh cold, and made his way down the hill to the village, his comrade marvelling much at his foolishness and softness of heart.	8
335	What a curious shape you are!	6
336	It is not comfortable here, he remarked, "but no doubt it is some fashionable watering-place, and they have sent me away to recruit my health.	1
337	I would much sooner have your good opinion than my silver buttons, any day', and he ran and plucked all his pretty primroses, and filled the Miller's basket.	0
338	I tell you what, you are very rude, and, after all, who are you?	2
339	Now it happened that one evening little Hans was sitting by his fireside when a loud rap came at the door.	6
340	Be happy, cried the Nightingale, "be happy, you shall have your red rose.	0
341	It was winter, and a night of bitter cold.	3
342	And what would you do in return? said the little bird, swinging upon a silver spray, and flapping his tiny wings.	7
343	He must have a truly romantic nature, said the Catherine Wheel, "for he weeps when there is nothing at all to weep about"; and she heaved a deep sigh, and thought about the deal box.	6
344	No pity had he for the poor, or for those who were blind or maimed or in any way afflicted, but would cast stones at them and drive them forth on to the highway, and bid them beg their bread elsewhere, so that none save the outlaws came twice to that village to ask for alms.	3
345	That is what is called sympathy.	4
346	And I am so afraid the Pike may meet them.	3
347	You know I am going to give you my wheelbarrow, and so, it is only fair that you should do something for me in return.'	7
348	And the Star–Child wept and bowed his head, and prayed forgiveness of God’s things, and went on through the forest, seeking for the beggar–woman.	7
349	They are like the Aurora Borealis, said the King, who always answered questions that were addressed to other people, "only much more natural.	8
350	If I bring her a red rose she will dance with me till dawn.	7
351	'Nay, but thou hadst pity on me first,' said the Hare, and it ran away swiftly.	8
352	'Alas! my son,' she cried, 'wilt thou not kiss me before I go?	1
353	So the Star–Child went to the wood, and all day long he searched for the piece of yellow gold, but nowhere could he find it.	7
354	At last, however, the fire caught him.	8
355	Now I am going to explode, he cried.	3
356	So at the end of the King's garden a great stand had been set up, and as soon as the Royal Pyrotechnist had put everything in its proper place, the fireworks began to talk to each other.	7
357	Spring has forgotten this garden, they cried, "so we will live here all the year round."	1
358	How I would like to see him! he used to say.	7
359	'I tell you that it is all the fault of the Government, and if you don’t believe me I shall eat you.' The Wolf had a thoroughly practical mind, and was never at a loss for a good argument.	2
360	The young Student was still lying on the grass, where she had left him, and the tears were not yet dry in his beautiful eyes.	1
361	One winter morning he looked out of his window as he was dressing. 	8
362	But the Catherine Wheel shook her head.	1
363	From her nest in the holm-oak tree the Nightingale heard him, and she looked out through the leaves, and wondered.	6
364	 'Besides,' he used to say, 'he is going to give me his wheelbarrow, and that 'is an act of pure generosity.'	0
365	Dear me! said the little Squib, "I thought it was quite the other way, and that we were to be let off in the Prince's honour."	6
366	'Thou speakest truly,' answered the Woodcutter, 'yet did I show thee pity when I found thee in the forest.'	0
367	I am sure I hope so, but the sky is quite blue and cloudless.	1
368	Echo bore it to her purple cavern in the hills, and woke the sleeping shepherds from their dreams.	0
369	They wrote so much about it that nobody believed them, and I am not surprised.	5
370	And the Star–Child entered the cavern, and in its farthest corner he found the piece of red gold.	7
371	'Come thou with me,' said the Hare, 'and I will lead thee to it, for I know where it is hidden, and for what purpose.'	6
372	The climate in the north of Europe is really dreadful.	3
373	It is a very dangerous thing to know one's friends.	3
374	And they said to him, 'It is a beggar and the child of a beggar, and we have driven him away.'	1
375	Nay! answered the child; "but these are the wounds of Love."	4
376	But the storm grew worse and worse, and the rain fell in torrents, and little Hans could not see where he was going, or keep up with the horse.	3
377	Thy mother dwells not in this city.'	1
378	And the Tree cried to the Nightingale to press closer against the thorn.	3
379	So the Magician fell upon him, and beat him, and loaded him with chains, and cast him again into the dungeon.	2
380	And the little page opened his big blue eyes in wonder, and said smiling to him, 'My lord, I see thy robe and thy sceptre, but where is thy crown?'	6
381	'Dear little Hans,' cried the Miller, 'I am in great trouble.	1
382	And the Star–Child answered, 'I am seeking for a piece of yellow gold that is hidden here, and if I find it not my master will beat me, and keep me as a slave.'	3
383	Who hath dared to wound thee? cried the Giant; "tell me, that I may take my big sword and slay him."	2
384	No red rose in all my garden! he cried, and his beautiful eyes filled with tears.	1
385	He was so small that he could not reach up to the branches of the tree, and he was wandering all round it, crying bitterly.	1
386	You certainly are! cried the Bengal Light.	6
387	Pearls and pomegranates cannot buy it, nor is it set forth in the marketplace.	0
388	The Student looked up from the grass, and listened, but he could not understand what the Nightingale was saying to him, for he only knew the things that are written down in books.	5
389	In fact, it is essentially suburban.	5
390	He flew so high that the people were afraid that he would never come down again.	3
391	TRESPASSERS WILL BE PROSECUTED	3
392	My roses are white, it answered, "as white as the foam of the sea, and whiter than the snow upon the mountain.	0
393	Once upon a time, said the Linnet, "there was an honest little fellow named Hans."	0
394	Everybody went to little Hans' funeral, as he was so popular, and the Miller was the chief mourner.	1
395	I hope not, said the Frog complacently.	7
396	You had really better keep yourself dry, said the Fire-balloon.	4
397	So he went to the well of water and looked into it, and lo! his face was as the face of a toad, and his body was sealed like an adder.	1
398	The Autumn gave golden fruit to every garden, but to the Giant's garden she gave none.	8
399	'Lots of people act well,' answered the Miller, 'but very few people talk well, which shows that talking is much the more difficult thing of the two, and much the finer thing also', and he	0
400	But the Nightingale understood the secret of the Student's sorrow, and she sat silent in the oak-tree, and thought about the mystery of Love.	7
401	Through a little hole in the wall the children had crept in, and they were sitting in the branches of the trees.	8
402	'Do you really think I shall?' asked little Hans.	0
403	And the Woodcutter carried her to his own house, and his wife had care of her, and when she rose up from the swoon into which she had fallen, they set meat and drink before her, and bade her have comfort.	4
404	How happy we were there, they said to each other.	1
405	And the Star–Child frowned and said to himself, 'What is this that they say to me?	6
406	And on the morrow the Woodcutter took the curious cloak of gold and placed it in a great chest, and a chain of amber that was round the child’s neck his wife took and set it in the chest also.	7
407	I am sure that he has not often got such a chance of improving his mind.	4
408	But the leper entreated him sore, so that the Star–Child had pity on him, and gave him the piece of yellow gold.	4
409	Just look at those yellow tulips.	6
410	At the gate of the Castle the Prince was waiting to receive her.	7
411	But the thorn had not yet reached her heart, so the rose's heart remained white, for only a Nightingale's heart's-blood can crimson the heart of a rose.	4
412	Tell me, canst thou see my mother?'	3
413	And, as he turned away weeping, one whose armour was inlaid with gilt flowers, and on whose helmet couched a lion that had wings, came up and made inquiry of the soldiers who it was who had sought entrance.	6
414	Yes, that is just what I want to know, said the Duck, and she swam away to the end of the pond, and stood upon her head, in order to give her children a good example.	6
415	Here at last is a true lover, said the Nightingale.	0
416	He spoke of the matter at great length, and I am sure he must have been right, for he had blue spectacles and a bald head, and whenever the young man made any remark, he always answered 'Pooh!'	8
417	Therefore weep no more but be glad.'	0
418	'Well, really,' said the Miller, 'I think that, considering that I am going to give you my wheelbarrow, it is rather unfriendly of you to refuse.'	4
419	I dare say that if I knew him I should not be his friend at all.	5
420	One night there flew over the city a little Swallow.	8
421	However, I don't care a bit.	8
422	Really, when I begin to reflect on the importance of my position, I am almost moved to tears.	1
423	But as they were bewailing their misery to each other this strange thing happened.	1
424	'Well, really, that is generous of you,' said little Hans, and his funny round face glowed all over with pleasure.	0
425	And being weary she sat her down under a chestnut–tree to rest.	8
426	But he answered him: 'Nay, for the cloak is neither mine nor thine, but the child’s only,' and he bade him Godspeed, and went to his own house and knocked.	8
427	'Weet! weet! weet!' twittered the green Linnets, 'the old Earth is dead and they have laid her out in her white shroud.'	6
428	'Ugh!' snarled the Wolf, as he limped through the brushwood with his tail between his legs, 'this is perfectly monstrous weather.	2
429	He played very badly, but no one had ever dared to tell him so, because he was the King.	5
430	Romance never dies.	7
431	Well, I said Pylotechnic, answered the Rocket, in a severe tone of voice, and the Bengal Light felt so crushed that he began at once to bully the little squibs, in order to show that he was still a person of some importance.	2
432	Why, if little Hans came up here, and saw our warm fire, and our good supper, and our great cask of red wine, he might get envious, and envy is a most terrible thing, and would spoil anybody's nature.	3
433	What a curious shape you are!	6
434	If so, I will listen to it, for I am extremely fond of fiction.	7
435	For I see none here but this vile beggar–woman.'	1
436	I never said I knew him, answered the Rocket.	4
437	But nobody saw him.	1
438	Good heavens! cried the Goose.	6
439	But a second rap came, and then a third, louder than any of the others.	3
440	Was he very distinguished? asked the Water-rat.	7
441	What disobedient children! cried the old Water-rat, "they really deserve to be drowned." 	5
442	What a pity!	1
443	Let us leave it here, and go our way, seeing that we are poor men, and have children of our own whose bread we may not give to another.'	8
444	The best thing in him was the gunpowder, and that was so wet with tears that it was of no use.	1
445	And the Linnet answered, 'Thou hast clipt my wings for thy pleasure.	2
446	So the Nightingale flew over to the Rose-tree that was growing round the old sun-dial.	7
447	'What a silly boy you are'! cried the Miller, 'I really don't know what is the use of sending you to school.	2
448	Often did the old priest send for him, and seek to teach him the love of living things, saying to him: 'The fly is thy brother.	4
449	Why! 	6
450	But the Tree shook its head.	1
451	As they passed the column he looked up at the statue: "Dear me! how shabby the Happy Prince looks!" he said.	6
452	'You are certainly very thoughtful about others,' answered the Wife, as she sat in her comfortable armchair by the big pinewood fire, 'very thoughtful indeed.	0
453	 I shall never get over it."	1
454	Flamecoloured are his wings, and coloured like flame is his body.	6
455	And the Star–Child took the piece of yellow gold, and put it in his wallet, and hurried to the city.	7
456	The negroes chattered to each other, and began to quarrel over a string of bright beads. 	2
457	Anybody can say charming things and try to please and to flatter, but a true friend always says unpleasant things, and does not mind giving pain.	4
458	They were extremely practical, and whenever they objected to anything they called it humbug.	2
459	The Prince gives a ball to-morrow night, murmured the young Student, "and my love will be of the company.	7
460	Indeed, if he is a really true friend he prefers it, for he knows that then he is doing good.'	4
461	And his companions followed him, for he was fair, and fleet of foot, and could dance, and pipe, and make music.	0
462	So the Nightingale flew over to the Rose-tree that was growing beneath the Student's window.	7
463	Yes, you may set your mind at ease, I will give you my wheelbarrow.'	8
464	Look, look! cried the Tree, "the rose is finished now", but the Nightingale made no answer, for she was lying dead in the long grass, with the thorn in her heart.	7
465	The little Squirrels, who lived inside the tall fir–tree, kept rubbing each other’s noses to keep themselves warm, and the Rabbits curled themselves up in their holes, and did not venture even to look out of doors.	3
466	What are fireworks like? she had asked the Prince, one morning, as she was walking on the terrace.	7
467	I am his best friend, and I will always watch over him, and see that he is not led into any temptations.	4
468	You were talking about yourself, replied the Roman Candle.	8
469	But when I think that they might lose their only son, I certainly am very much affected."	1
470	Every one was a great success except the Remarkable Rocket.	6
471	But the Oak-tree understood, and felt sad, for he was very fond of the little Nightingale who had built her nest in his branches.	1
472	Get thee gone.	2
473	And the Star–Child grew red with anger, and stamped his foot upon the ground, and said, 'Who art thou to question me what I do?	2
474	Get thee away quickly, and at sunset I will be waiting for thee at the door of the garden.	7
475	So he came near and threw stones at her, and mocked her, and she looked at him with terror in her eyes, nor did she move her gaze from him.	3
476	Suddenly he rubbed his eyes in wonder, and looked and looked. 	6
477	At present you have only the practice of friendship, some day you will have the theory also.'	6
478	And when the children ran in that afternoon, they found the Giant lying dead under the tree, all covered with white blossoms.	1
479	Romance is dead, Romance is dead, Romance is dead, she murmured.	1
480	'And what signs didst thou find with him?' she cried.	7
481	I am going to bring them into the market and sell them to the Burgomaster's daughter, and buy back my wheelbarrow with the money.'	7
482	'It is some poor traveller,' said little Hans to himself, and he ran to the door.	7
483	And the woman answered him, 'I am thy mother.'	0
484	And when the woman heard these words she gave a loud cry, and fell into a swoon.	6
485	And what, pray, is your idea of the duties of a devoted friend? asked a Green Linnet, who was sitting in a willow-tree hard by, and had overheard the conversation.	4
486	He was something of a politician, and had always taken a prominent part in the local elections, so he knew the proper Parliamentary expressions to use.	8
487	No, answered the Linnet, "I don't think he was distinguished at all, except for his kind heart, and his funny round good-humoured face.	0
